{
  "$schema": "./orchestrator.schema.json",
  "tiers": {
    "XS": {
      "startproject": null,
      "team-implement": "opencode-go/glm-5.2",
      "team-review": null,
      "deploy": "opencode-go/glm-5.2"
    },
    "S": {
      "startproject": "opencode-go/glm-5.2",
      "team-implement": "opencode-go/kimi-k3",
      "team-review": "opencode-go/glm-5.2",
      "deploy": "opencode-go/glm-5.2"
    },
    "M": {
      "startproject": "opencode-go/kimi-k3",
      "team-implement": "opencode-go/kimi-k3",
      "team-review": "opencode-go/glm-5.2",
      "deploy": "opencode-go/glm-5.2"
    },
    "L": {
      "startproject": "opencode-go/kimi-k3",
      "team-implement": "opencode-go/kimi-k3",
      "team-review": "opencode-go/kimi-k3",
      "deploy": "opencode-go/kimi-k3"
    }
  },
  "thinkingLevel": {
    "startproject": "high",
    "team-implement": "medium",
    "team-review": "high",
    "deploy": "low"
  },
  "fallbackModel": "opencode-go/glm-5.2",
  "fallbackThinkingLevel": "medium",
  "budget": {
    "maxCostPerPhase": 1000.0,
    "maxTotalCost": 10000.0,
    "warnCostPerPhase": 500.0
  },
  "gates": {
    "gate1": true,
    "gate2": true,
    "dontAsk": false,
    "maxRetries": 1
  },
  "hardTriggers": [
    "auth",
    "authentication",
    "db migration",
    "database migration",
    "payment",
    "billing",
    "public api",
    "core dependency",
    "schema change"
  ],
  "taskFileDir": ".claude/docs/decisions",
  "linear": {
    "enabled": true,
    "idPattern": "[A-Z]+-[0-9]+"
  }
}